<?xml version="1.0" encoding="UTF-8"?>
<xs:schema xmlns:xs="http://www.w3.org/2001/XMLSchema">
	<xs:element name="Graph">
		<xs:annotation>
			<xs:documentation>Comment describing your root element</xs:documentation>
		</xs:annotation>
		<xs:complexType>
			<xs:sequence>
				<xs:element name="VertexCategory" type="VertexCategory" minOccurs="0" maxOccurs="unbounded"/>
				<xs:element name="EdgeCategory" type="EdgeCategory" minOccurs="0" maxOccurs="unbounded"/>
				<xs:element name="Vertex" type="Vertex" minOccurs="0" maxOccurs="unbounded"/>
				<xs:element name="Edge" type="Edge" minOccurs="0" maxOccurs="unbounded"/>
			</xs:sequence>
		</xs:complexType>
		<xs:key name="PK_EdgeCategory">
			<xs:selector xpath="EdgeCategory"/>
			<xs:field xpath="@Id"/>
		</xs:key>
		<xs:key name="PK_Vertex">
			<xs:selector xpath="Vertex"/>
			<xs:field xpath="@Id"/>
		</xs:key>
		<xs:key name="PK_VertexCategory">
			<xs:selector xpath="VertexCategory"/>
			<xs:field xpath="@Id"/>
		</xs:key>
		<xs:keyref name="FK_EdgeCategory" refer="PK_EdgeCategory">
			<xs:selector xpath="Edge"/>
			<xs:field xpath="@Category"/>
		</xs:keyref>
		<xs:keyref name="FK_EdgeDst" refer="PK_Vertex">
			<xs:selector xpath="Edge"/>
			<xs:field xpath="@Dst"/>
		</xs:keyref>
		<xs:keyref name="FK_EdgeSrc" refer="PK_Vertex">
			<xs:selector xpath="Edge"/>
			<xs:field xpath="@Src"/>
		</xs:keyref>
		<xs:keyref name="FK_VertexCategory" refer="PK_VertexCategory">
			<xs:selector xpath="Vertex"/>
			<xs:field xpath="@Category"/>
		</xs:keyref>
	</xs:element>
	<xs:complexType name="Edge">
		<xs:complexContent>
			<xs:extension base="Element">
				<xs:attribute name="Src" type="xs:string" use="required"/>
				<xs:attribute name="Dst" type="xs:string" use="required"/>
				<xs:attributeGroup ref="EdgeAttrs"/>
			</xs:extension>
		</xs:complexContent>
	</xs:complexType>
	<xs:complexType name="EdgeCategory">
		<xs:attribute name="Id" type="xs:string" use="required"/>
		<xs:attributeGroup ref="EdgeAttrs"/>
	</xs:complexType>
	<xs:complexType name="Element" abstract="true">
		<xs:attribute name="Category" type="xs:string" use="optional"/>
		<xs:attribute name="Label" type="xs:string" use="optional"/>
		<xs:attribute name="Stroke" type="Color" use="optional" default="Black"/>
		<xs:attribute name="StrokeThickness" type="xs:double" use="optional" default="1"/>
	</xs:complexType>
	<xs:complexType name="Vertex">
		<xs:complexContent>
			<xs:extension base="Element">
				<xs:attribute name="Id" type="xs:string" use="required"/>
				<xs:attributeGroup ref="VertexAttrs"/>
			</xs:extension>
		</xs:complexContent>
	</xs:complexType>
	<xs:complexType name="VertexCategory">
		<xs:attribute name="Id" type="xs:string" use="required"/>
		<xs:attributeGroup ref="VertexAttrs"/>
	</xs:complexType>
	<xs:simpleType name="Color">
		<xs:restriction base="xs:string">
			<xs:pattern value="#[\da-f]{6}|AliceBlue|AntiqueWhite|Aqua|Aquamarine|Azure|Beige|Bisque|Black|BlanchedAlmond|Blue|BlueViolet|Brown|BurlyWood|CadetBlue|Chartreuse|Chocolate|Coral|CornflowerBlue|Cornsilk|Crimson|Cyan|DarkBlue|DarkCyan|DarkGoldenrod|DarkGray|DarkGreen|DarkKhaki|DarkMagenta|DarkOliveGreen|DarkOrange|DarkOrchid|DarkRed|DarkSalmon|DarkSeaGreen|DarkSlateBlue|DarkSlateGray|DarkTurquoise|DarkViolet|DeepPink|DeepSkyBlue|DimGray|DodgerBlue|Firebrick|FloralWhite|ForestGreen|Fuchsia|Gainsboro|GhostWhite|Gold|Goldenrod|Gray|Green|GreenYellow|Honeydew|HotPink|IndianRed|Indigo|Ivory|Khaki|Lavender|LavenderBlush|LawnGreen|LemonChiffon|LightBlue|LightCoral|LightCyan|LightGoldenrodYellow|LightGray|LightGreen|LightPink|LightSalmon|LightSeaGreen|LightSkyBlue|LightSlateGray|LightSteelBlue|LightYellow|Lime|LimeGreen|Linen|Magenta|Maroon|MediumAquamarine|MediumBlue|MediumOrchid|MediumPurple|MediumSeaGreen|MediumSlateBlue|MediumSpringGreen|MediumTurquoise|MediumVioletRed|MidnightBlue|MintCream|MistyRose|Moccasin|NavajoWhite|Navy|OldLace|Olive|OliveDrab|Orange|OrangeRed|Orchid|PaleGoldenrod|PaleGreen|PaleTurquoise|PaleVioletRed|PapayaWhip|PeachPuff|Peru|Pink|Plum|PowderBlue|Purple|Red|RosyBrown|RoyalBlue|SaddleBrown|Salmon|SandyBrown|SeaGreen|SeaShell|Sienna|Silver|SkyBlue|SlateBlue|SlateGray|Snow|SpringGreen|SteelBlue|Tan|Teal|Thistle|Tomato|Transparent|Turquoise|Violet|Wheat|White|WhiteSmoke|Yellow|YellowGreen"/>
		</xs:restriction>
	</xs:simpleType>
	<xs:simpleType name="VertexShape">
		<xs:restriction base="xs:string">
			<xs:enumeration value="None"/>
			<xs:enumeration value="Ellipse"/>
			<xs:enumeration value="Rectangle"/>
			<xs:enumeration value="Diamond"/>
		</xs:restriction>
	</xs:simpleType>
	<xs:attributeGroup name="EdgeAttrs">
		<xs:attribute name="Weight" type="xs:double" use="optional" default="1"/>
		<xs:attribute name="Style" type="EdgeStyle" use="optional" default="Solid"/>
	</xs:attributeGroup>
	<xs:attributeGroup name="VertexAttrs">
		<xs:attribute name="Background" type="Color" use="optional" default="LightGray"/>
		<xs:attribute name="Foreground" type="Color" use="optional" default="Black"/>
		<xs:attribute name="Shape" type="VertexShape" use="optional" default="Ellipse"/>
	</xs:attributeGroup>
	<xs:simpleType name="EdgeStyle">
		<xs:restriction base="xs:string">
			<xs:enumeration value="Solid"/>
			<xs:enumeration value="Dashed"/>
		</xs:restriction>
	</xs:simpleType>
</xs:schema>